"Status","Start Time","Stop Time","Duration in ms","Parent Suite","Suite","Sub Suite","Test Class","Test Method","Name","Description"
"passed","Thu Nov 17 00:42:38 GMT 2022","Thu Nov 17 00:42:38 GMT 2022","448","","About","","About","should open about","should open about",""
"passed","Thu Nov 17 00:42:32 GMT 2022","Thu Nov 17 00:42:33 GMT 2022","938","","Search functionality","","Search functionality","should load landing page properly","should load landing page properly",""
"passed","Thu Nov 17 00:42:35 GMT 2022","Thu Nov 17 00:42:35 GMT 2022","39","","Search functionality","","Search functionality","should verify title text","should verify title text",""
"passed","Thu Nov 17 00:42:35 GMT 2022","Thu Nov 17 00:42:35 GMT 2022","20","","Search functionality","","Search functionality","should check first result in the list","should check first result in the list",""
"passed","Thu Nov 17 00:42:35 GMT 2022","Thu Nov 17 00:42:35 GMT 2022","22","","Search functionality","","Search functionality","should be 10 results on page","should be 10 results on page",""
"passed","Thu Nov 17 00:42:38 GMT 2022","Thu Nov 17 00:42:39 GMT 2022","146","","About","","About","should be on about page","should be on about page",""
"passed","Thu Nov 17 00:42:35 GMT 2022","Thu Nov 17 00:42:38 GMT 2022","3141","","Search functionality","","Search functionality","should click on selection","should click on selection",""
"passed","Thu Nov 17 00:42:33 GMT 2022","Thu Nov 17 00:42:35 GMT 2022","1547","","Search functionality","","Search functionality","should make a search","should make a search",""
